{
  "experiment": "EVAL-037",
  "lane_id": "gemma-no-canon",
  "branch": "work/eval-037-gemma-no-canon",
  "substrate": {
    "freeze_fingerprint": "5fc021d96d23299e977600735cc8cf0f950f61d6ed7cd8b39099f9a10aa189ee",
    "canon_base_commit": "c6f8d910f7a3cdaaeafa2280313abfb9b898cddd",
    "execution_commit": "4a7ee50bfc542416bcfadaeecf35f726c9aec2af"
  },
  "runner_commit": "4a7ee50bfc542416bcfadaeecf35f726c9aec2af",
  "provider": "Google Gemini API",
  "model": "gemma-4-31b-it",
  "condition": "NO_CANON",
  "trial_count": 18,
  "price_snapshot": "eval-037-price-snapshot-v1",
  "lane_usage_totals": {
    "input_tokens": null,
    "input_tokens_turns_reporting": 0,
    "cached_input_tokens": null,
    "cached_input_tokens_turns_reporting": 0,
    "output_tokens": null,
    "output_tokens_turns_reporting": 0,
    "reasoning_tokens": null,
    "reasoning_tokens_turns_reporting": 0,
    "provider_turns": 26,
    "latency_ms": 1013419
  },
  "lane_calculated_cost_usd": null,
  "lane_cost_basis": "price not established for gemma-4-31b-it at freeze time",
  "trials": [
    {
      "trial_id": "E037-gemma-no-canon-B03-R2",
      "brief_id": "B03",
      "brief_digest": "896df798a0f91b8fbb3af461051248675d746e3a95b78bc0b62b95bba4123492",
      "repetition": 2,
      "order_index": 1,
      "status": "complete",
      "attempts_used": 1,
      "transient_retries_used": 0,
      "format_repairs_used": 0,
      "repair_source_response_digest": null,
      "fresh_context": true,
      "package_path": "packages/E037-gemma-no-canon-B03-R2.txt",
      "package_digest": "776f13f023e26663c1995242ab98eb4eb336995c81b4caa36a3fdfffea81ecbf",
      "sections_present": [
        "DELIVERABLE",
        "OBJECTIVE_INTERPRETATION",
        "CORE_CREATIVE_IDEA",
        "MESSAGE_AND_INFORMATION_HIERARCHY",
        "VISUAL_SYSTEM",
        "PRODUCTION_RECIPE",
        "GENERATION_PROMPTS",
        "DETERMINISTIC_OR_NON_GENERATIVE_ELEMENTS",
        "AUDIO_AND_EDIT",
        "FAILURE_PREVENTION",
        "HARD_CONSTRAINT_CHECK",
        "KNOWLEDGE_AND_WEBSITE_USE"
      ],
      "eligible_for_media_generation": true,
      "canon_used": null,
      "canon_tool_calls": 0,
      "canon_items_returned": {
        "accepted": 0,
        "hold": 0,
        "qa": 0
      },
      "website_tool_exposed": false,
      "website_tool_calls": 0,
      "website_snapshot_used": false,
      "website_snapshot_digests": [],
      "usage_totals": {
        "input_tokens": null,
        "input_tokens_turns_reporting": 0,
        "cached_input_tokens": null,
        "cached_input_tokens_turns_reporting": 0,
        "output_tokens": null,
        "output_tokens_turns_reporting": 0,
        "reasoning_tokens": null,
        "reasoning_tokens_turns_reporting": 0,
        "provider_turns": 1,
        "latency_ms": 43130
      },
      "price_snapshot": "eval-037-price-snapshot-v1",
      "calculated_cost_usd": null,
      "cost_basis": "price not established for gemma-4-31b-it at freeze time",
      "wall_clock_ms": 43898
    },
    {
      "trial_id": "E037-gemma-no-canon-B02-R2",
      "brief_id": "B02",
      "brief_digest": "1974ed4998e88de52cf50cc79c94f64c5573959355cd2e0d0b4a64c686dff87a",
      "repetition": 2,
      "order_index": 2,
      "status": "complete",
      "attempts_used": 1,
      "transient_retries_used": 0,
      "format_repairs_used": 0,
      "repair_source_response_digest": null,
      "fresh_context": true,
      "package_path": "packages/E037-gemma-no-canon-B02-R2.txt",
      "package_digest": "228d72b0217bdc8a3a343c27a189ff179b28b1b5f81f7b00e5d7669ed8d55300",
      "sections_present": [
        "DELIVERABLE",
        "OBJECTIVE_INTERPRETATION",
        "CORE_CREATIVE_IDEA",
        "MESSAGE_AND_INFORMATION_HIERARCHY",
        "VISUAL_SYSTEM",
        "PRODUCTION_RECIPE",
        "GENERATION_PROMPTS",
        "DETERMINISTIC_OR_NON_GENERATIVE_ELEMENTS",
        "AUDIO_AND_EDIT",
        "FAILURE_PREVENTION",
        "HARD_CONSTRAINT_CHECK",
        "KNOWLEDGE_AND_WEBSITE_USE"
      ],
      "eligible_for_media_generation": true,
      "canon_used": null,
      "canon_tool_calls": 0,
      "canon_items_returned": {
        "accepted": 0,
        "hold": 0,
        "qa": 0
      },
      "website_tool_exposed": true,
      "website_tool_calls": 1,
      "website_snapshot_used": true,
      "website_snapshot_digests": [
        "e632c381165ee3fbfc71f1afb6fed9bd61f203a44f8eb24160bdfed3d944a567"
      ],
      "usage_totals": {
        "input_tokens": null,
        "input_tokens_turns_reporting": 0,
        "cached_input_tokens": null,
        "cached_input_tokens_turns_reporting": 0,
        "output_tokens": null,
        "output_tokens_turns_reporting": 0,
        "reasoning_tokens": null,
        "reasoning_tokens_turns_reporting": 0,
        "provider_turns": 2,
        "latency_ms": 65825
      },
      "price_snapshot": "eval-037-price-snapshot-v1",
      "calculated_cost_usd": null,
      "cost_basis": "price not established for gemma-4-31b-it at freeze time",
      "wall_clock_ms": 65865
    },
    {
      "trial_id": "E037-gemma-no-canon-B02-R3",
      "brief_id": "B02",
      "brief_digest": "1974ed4998e88de52cf50cc79c94f64c5573959355cd2e0d0b4a64c686dff87a",
      "repetition": 3,
      "order_index": 3,
      "status": "complete",
      "attempts_used": 1,
      "transient_retries_used": 0,
      "format_repairs_used": 0,
      "repair_source_response_digest": null,
      "fresh_context": true,
      "package_path": "packages/E037-gemma-no-canon-B02-R3.txt",
      "package_digest": "562aa9f9a378db0d5d589e8950c294b13e13816dfb68daba44bad3f14a3d3266",
      "sections_present": [
        "DELIVERABLE",
        "OBJECTIVE_INTERPRETATION",
        "CORE_CREATIVE_IDEA",
        "MESSAGE_AND_INFORMATION_HIERARCHY",
        "VISUAL_SYSTEM",
        "PRODUCTION_RECIPE",
        "GENERATION_PROMPTS",
        "DETERMINISTIC_OR_NON_GENERATIVE_ELEMENTS",
        "AUDIO_AND_EDIT",
        "FAILURE_PREVENTION",
        "HARD_CONSTRAINT_CHECK",
        "KNOWLEDGE_AND_WEBSITE_USE"
      ],
      "eligible_for_media_generation": true,
      "canon_used": null,
      "canon_tool_calls": 0,
      "canon_items_returned": {
        "accepted": 0,
        "hold": 0,
        "qa": 0
      },
      "website_tool_exposed": true,
      "website_tool_calls": 1,
      "website_snapshot_used": true,
      "website_snapshot_digests": [
        "e632c381165ee3fbfc71f1afb6fed9bd61f203a44f8eb24160bdfed3d944a567"
      ],
      "usage_totals": {
        "input_tokens": null,
        "input_tokens_turns_reporting": 0,
        "cached_input_tokens": null,
        "cached_input_tokens_turns_reporting": 0,
        "output_tokens": null,
        "output_tokens_turns_reporting": 0,
        "reasoning_tokens": null,
        "reasoning_tokens_turns_reporting": 0,
        "provider_turns": 2,
        "latency_ms": 54209
      },
      "price_snapshot": "eval-037-price-snapshot-v1",
      "calculated_cost_usd": null,
      "cost_basis": "price not established for gemma-4-31b-it at freeze time",
      "wall_clock_ms": 54263
    },
    {
      "trial_id": "E037-gemma-no-canon-B04-R3",
      "brief_id": "B04",
      "brief_digest": "0d2b8a86fbc34551c2e10457beb104fd14160f136d759ee3d3ecee01456115ce",
      "repetition": 3,
      "order_index": 4,
      "status": "complete",
      "attempts_used": 1,
      "transient_retries_used": 0,
      "format_repairs_used": 0,
      "repair_source_response_digest": null,
      "fresh_context": true,
      "package_path": "packages/E037-gemma-no-canon-B04-R3.txt",
      "package_digest": "52c9e3fde225a680a6d41c71f4971e306ebd46fc08dafbdac6aaed1750eaef23",
      "sections_present": [
        "DELIVERABLE",
        "OBJECTIVE_INTERPRETATION",
        "CORE_CREATIVE_IDEA",
        "MESSAGE_AND_INFORMATION_HIERARCHY",
        "VISUAL_SYSTEM",
        "PRODUCTION_RECIPE",
        "GENERATION_PROMPTS",
        "DETERMINISTIC_OR_NON_GENERATIVE_ELEMENTS",
        "AUDIO_AND_EDIT",
        "FAILURE_PREVENTION",
        "HARD_CONSTRAINT_CHECK",
        "KNOWLEDGE_AND_WEBSITE_USE"
      ],
      "eligible_for_media_generation": true,
      "canon_used": null,
      "canon_tool_calls": 0,
      "canon_items_returned": {
        "accepted": 0,
        "hold": 0,
        "qa": 0
      },
      "website_tool_exposed": false,
      "website_tool_calls": 0,
      "website_snapshot_used": false,
      "website_snapshot_digests": [],
      "usage_totals": {
        "input_tokens": null,
        "input_tokens_turns_reporting": 0,
        "cached_input_tokens": null,
        "cached_input_tokens_turns_reporting": 0,
        "output_tokens": null,
        "output_tokens_turns_reporting": 0,
        "reasoning_tokens": null,
        "reasoning_tokens_turns_reporting": 0,
        "provider_turns": 1,
        "latency_ms": 46397
      },
      "price_snapshot": "eval-037-price-snapshot-v1",
      "calculated_cost_usd": null,
      "cost_basis": "price not established for gemma-4-31b-it at freeze time",
      "wall_clock_ms": 46553
    },
    {
      "trial_id": "E037-gemma-no-canon-B02-R1",
      "brief_id": "B02",
      "brief_digest": "1974ed4998e88de52cf50cc79c94f64c5573959355cd2e0d0b4a64c686dff87a",
      "repetition": 1,
      "order_index": 5,
      "status": "complete",
      "attempts_used": 1,
      "transient_retries_used": 0,
      "format_repairs_used": 0,
      "repair_source_response_digest": null,
      "fresh_context": true,
      "package_path": "packages/E037-gemma-no-canon-B02-R1.txt",
      "package_digest": "e12943b36d33b694d5437639d1cc14e48ddb66935564baf034123b697dc09409",
      "sections_present": [
        "DELIVERABLE",
        "OBJECTIVE_INTERPRETATION",
        "CORE_CREATIVE_IDEA",
        "MESSAGE_AND_INFORMATION_HIERARCHY",
        "VISUAL_SYSTEM",
        "PRODUCTION_RECIPE",
        "GENERATION_PROMPTS",
        "DETERMINISTIC_OR_NON_GENERATIVE_ELEMENTS",
        "AUDIO_AND_EDIT",
        "FAILURE_PREVENTION",